{
  "$schema": "https://json-schema.org/draft/2020-12/schema",
  "title": "DecisionEnvelope",
  "type": "object",
  "additionalProperties": false,
  "required": [
    "request_id",
    "status",
    "provider",
    "model",
    "policy_version",
    "answers",
    "usage",
    "latency_ms"
  ],
  "properties": {
    "request_id": {
      "type": "string"
    },
    "status": {
      "enum": [
        "ok",
        "abstain",
        "provider_error"
      ]
    },
    "provider": {
      "type": "string"
    },
    "model": {
      "type": "string"
    },
    "policy_version": {
      "type": "string"
    },
    "calibration_version": {
      "type": [
        "string",
        "null"
      ]
    },
    "answers": {
      "type": "object",
      "maxProperties": 20,
      "additionalProperties": {
        "type": "object",
        "required": [
          "type"
        ],
        "properties": {
          "type": {
            "enum": [
              "choice",
              "score",
              "noul"
            ]
          },
          "choice": {
            "type": "string"
          },
          "score": {
            "type": "number"
          },
          "noul": {
            "type": "number",
            "minimum": 0,
            "maximum": 1
          },
          "confidence": {
            "type": "number",
            "minimum": 0,
            "maximum": 1
          },
          "probabilities": {
            "type": "object",
            "additionalProperties": {
              "type": "number",
              "minimum": 0,
              "maximum": 1
            }
          }
        }
      }
    },
    "usage": {
      "type": "object",
      "additionalProperties": false,
      "required": [
        "input_tokens"
      ],
      "properties": {
        "input_tokens": {
          "type": "integer",
          "minimum": 0
        },
        "output_tokens": {
          "type": "integer",
          "minimum": 0
        }
      }
    },
    "latency_ms": {
      "type": "integer",
      "minimum": 0
    },
    "fallback_reason": {
      "type": [
        "string",
        "null"
      ]
    }
  }
}
