{
  "request_id": "req_pilot_0000001",
  "status": "ok",
  "provider": "typesafe",
  "model": "jev-1.13.0",
  "policy_version": "policy_1",
  "calibration_version": null,
  "answers": {
    "buyer_intent": {
      "type": "choice",
      "choice": "portable_work",
      "probabilities": {
        "portable_work": 0.9,
        "gaming": 0.02,
        "everyday_value": 0.05,
        "unknown": 0.03
      },
      "confidence": 0.8
    },
    "would_comparison_help": {
      "type": "noul",
      "noul": 0.79
    }
  },
  "usage": {
    "input_tokens": 420,
    "output_tokens": 20
  },
  "latency_ms": 190,
  "fallback_reason": null
}
